Twitter ID,release date,comment,time,replies,retweets,likes,timestamp,stance
-4173513326995098160,Thu Jan 30 2020,"@janefourmillion @JavelinaBlue @AlanDersh Interesting!Do you happen to know anything about the trademarks that Ivanka reportedly got in China, for new voting machines?",Thu Jan 30 06:25:37 +0000 2020,0,1,1,42:41.7,comment
-4173513326995098160,Thu Jan 30 2020,"@saltygulf @JavelinaBlue @AlanDersh Meanwhile, the Orange Emolumental  is registering his companys trademarks in countries where he is manipulating their economies. I am a #trademark lawyer. I follow this stuff.",Thu Jan 30 05:19:27 +0000 2020,5,9,9,42:41.7,comment
-4173513326995098160,Thu Jan 30 2020,"@saltygulf @JavelinaBlue @AlanDersh It is almost certain that she has no voting machines.  Nor do Armani, Ray Ban, Tory Burch, Levi Strauss, Burberry, or YSL. Nor  does Chanel have atomic ray equipment, despite its Chinese registration for such.",Thu Jan 30 07:02:46 +0000 2020,1,3,3,42:41.7,comment
-4173513326995098160,Thu Jan 30 2020,@janefourmillion @JavelinaBlue @AlanDersh What does that mean? It sounds so shady.,Thu Jan 30 07:04:24 +0000 2020,0,1,1,42:41.7,comment
-4173513326995098160,Thu Jan 30 2020,@saltygulf @JavelinaBlue @AlanDersh Yes.  I wrote this article all anout it!  https://t.co/yMnytnk7bC,Thu Jan 30 06:29:51 +0000 2020,2,8,8,42:41.7,comment
-4173513326995098160,Thu Jan 30 2020,Thankfully that is a really bad defense! @AlanDersh#hogwashAlan Dershowitz suggested that a president acting in the publics interest cant be impeached. He then argued that a president may believe his own reelection is in the countrys best interesthttps://t.co/sOQDdzQP5b,Wed Jan 29 23:09:51 +0000 2020,10,15,15,42:41.7,deny
-4173513326995098160,Thu Jan 30 2020,@janefourmillion @JavelinaBlue I agree with you!And I'm relieved Ivanka has no voting machines. Many were worried.,Thu Jan 30 07:17:44 +0000 2020,0,2,2,42:41.7,support
-4173513326995098160,Thu Jan 30 2020,"@janefourmillion @JavelinaBlue @AlanDersh That is an interesting read.So Ivanka does have a trademark from China, for voting machines and other items. But there is no way of knowing if she is in pocession of voting machines, if I read it right.",Thu Jan 30 06:42:09 +0000 2020,0,2,2,42:41.7,comment
-4173513326995098160,Thu Jan 30 2020,"@saltygulf @JavelinaBlue PS I hate Ivanka, but I assure you she has NO applications for voting machines in the US, where she would need to make actual use of the trademark on voting machines to get trademark rights. She has no voting machines.",Thu Jan 30 07:12:57 +0000 2020,2,2,2,42:41.7,comment
