Twitter ID,release date,comment,time,replies,retweets,likes,timestamp,stance
-5293414205722039460,Sat Feb 08 2020,"@ustshssc Not bad, eye protection is also required to avoid getting it through air-born droplets to the eyes.",Sat Feb 08 11:27:16 +0000 2020,0,0,0,29:24.5,support
-5293414205722039460,Sat Feb 08 2020,@ustshssc ang ganda jeth! @jethro_rumbaoa rumbao naman pala hahaha,Sat Feb 08 13:03:57 +0000 2020,0,1,1,29:24.5,comment
-5293414205722039460,Sat Feb 08 2020,"References:Aljazeera. (January 31, 2020). Coronavirus: All you need to know about symptoms and risks. Retrieved from https://t.co/g3qmFIuJ4B",Sat Feb 08 10:37:21 +0000 2020,1,2,2,29:24.5,comment
-5293414205722039460,Sat Feb 08 2020,"European Centre for Disease Prevention and Control. (January 31, 2020). Geographical distribution of 2019-nCov cases globally. Retrieved from https://t.co/MUpsTO0wkuNSW Health. (n.d.). Novel coronavirus - Frequently asked questions. Retrieved from https://t.co/RRLyAR7AfS",Sat Feb 08 10:37:22 +0000 2020,1,2,2,29:24.5,comment
-5293414205722039460,Sat Feb 08 2020,"Centers for Disease Control and Prevention. (n.d.). 2019 Novel Coronavirus, Wuhan, China, Prevention &amp; Treatment. Retrieved from https://t.co/FDf3IO9aYA",Sat Feb 08 10:37:21 +0000 2020,1,2,2,29:24.5,comment
