Twitter ID,release date,comment,time,replies,retweets,likes,timestamp,stance
https://mobile.twitter.com/FOHMaster/status/1234056210439188480,Sun Mar 01 2020,@PeaseRoland @killerswan @JeremyFarrar @NIH @CEPIvaccines So this conclusion was regarding SARS 1?,Sun Mar 01 11:14:17 +0000 2020,0,0,0,29:37.5,query
https://mobile.twitter.com/FOHMaster/status/1234056210439188480,Sun Mar 01 2020,"@FOHMaster @killerswan @JeremyFarrar @NIH @CEPIvaccines Do you know the background/source to this account?My quick search on Google scholar unearthed this review article mentioning hypersensitivity.But the test was done in mice, as one would expect. https://t.co/Zya55QkRcq",Sun Mar 01 09:59:32 +0000 2020,0,1,1,29:37.5,query
https://mobile.twitter.com/FOHMaster/status/1234056210439188480,Sun Mar 01 2020,@JeremyFarrar @NIH @CEPIvaccines Anyone who signs up for that trial is absolutely crazy.,Sun Mar 01 00:05:26 +0000 2020,0,1,1,29:37.5,comment
https://mobile.twitter.com/FOHMaster/status/1234056210439188480,Sun Mar 01 2020,"@killerswan @JeremyFarrar @NIH @CEPIvaccines The attempted SARS 1 vaccine actually caused immunopathogenesis when challenged. Not saying this is the same situation, but it sounds like they skipped animal testing ?",Sun Mar 01 00:46:05 +0000 2020,0,0,0,29:37.5,comment
https://mobile.twitter.com/FOHMaster/status/1234056210439188480,Sun Mar 01 2020,"@FOHMaster @JeremyFarrar @NIH @CEPIvaccines people sign up for trials of stuff all the time!but yeahhhhh, one of the HIV vaccination trials a few years ago was abruptly stopped when they realized their vaccine made people _more likely_ to get HIV: trials are necessary!!",Sun Mar 01 00:33:39 +0000 2020,0,0,0,29:37.5,support
https://mobile.twitter.com/FOHMaster/status/1234056210439188480,Sun Mar 01 2020,"@FOHMaster @killerswan @JeremyFarrar @NIH @CEPIvaccines This was a review article 2009, so c 5 yrs after the peak of research. One of the problems (at least, they say) is that after the outbreak was over, there was no way to test the efficacy of vaccines in people.Work has been done since with MERS, but I haven't checked it (yet).",Sun Mar 01 11:40:05 +0000 2020,0,0,0,29:37.5,comment
https://mobile.twitter.com/FOHMaster/status/1234056210439188480,Sun Mar 01 2020,"COVID-19 Vaccine Shipped, and Drug Trials Start | Time - work supported by @NIH &amp; @CEPIvaccines https://t.co/SSvI8Wdb39",Thu Feb 27 23:27:42 +0000 2020,325,638,638,29:37.5,comment
