Twitter ID,release date,comment,time,replies,retweets,likes,timestamp,stance
https://mobile.twitter.com/charliekirk11/status/1236758809340784642,Sun Mar 08 2020,Nancy Pelosi tore up the State of the Union speechChuck Schumer threatened conservative justices by nameBernie won't condemn his supporters attacking Trump supportersRemind me again how the president is the one dividing the country?,Sat Mar 07 00:55:17 +0000 2020,24414,64140,64140,53:03.1,support
https://mobile.twitter.com/charliekirk11/status/1236758809340784642,Sun Mar 08 2020,"@charliekirk11 If anybody here thinks our country's response and testing for COVID-19 is great compared to South Korea for instance is great, then you must have really low standards for America, or have your head in the sand. Saying you are great doesn't matter if actual performance is bad.",Sat Mar 07 01:25:47 +0000 2020,0,10,10,53:03.1,comment
https://mobile.twitter.com/charliekirk11/status/1236758809340784642,Sun Mar 08 2020,"@charliekirk11 2/ Some of us care about America actually performing greatly, not the pathetic performance that Charlie and Trump can sell as ""Great"". Charlie the Grifter is trying to distract from how poorly we are testing COVID-19 under Trump's leadership. https://t.co/me5KnUX2dl",Sat Mar 07 01:31:57 +0000 2020,0,10,10,53:03.1,comment
https://mobile.twitter.com/charliekirk11/status/1236758809340784642,Sun Mar 08 2020,"@Netpropheting @charliekirk11 You know that Trump lied that anybody who wanted a test got a test, right? And do you believe his claim about Obama changing a rule that set the testing response back?",Sun Mar 08 21:04:39 +0000 2020,0,2,2,53:08.8,comment
https://mobile.twitter.com/charliekirk11/status/1236758809340784642,Sun Mar 08 2020,"@charliekirk11 If anybody here thinks our country's response and testing for COVID-19 is great compared to South Korea for instance is great, then you must have really low standards for America, or have your head in the sand. Saying you are great doesn't matter if actual performance is bad.",Sat Mar 07 01:25:47 +0000 2020,0,10,10,53:08.8,comment
https://mobile.twitter.com/charliekirk11/status/1236758809340784642,Sun Mar 08 2020,"@charliekirk11 2/ Some of us care about America actually performing greatly, not the pathetic performance that Charlie and Trump can sell as ""Great"". Charlie the Grifter is trying to distract from how poorly we are testing COVID-19 under Trump's leadership. https://t.co/me5KnUX2dl",Sat Mar 07 01:31:57 +0000 2020,0,10,10,53:08.8,comment
https://mobile.twitter.com/charliekirk11/status/1236758809340784642,Sun Mar 08 2020,@darinp2 @charliekirk11 Fauci said CDC made missteps &amp; now those have corrected &amp; 4 million test kits will be distributed this week.  The most important thing we can all do is community containment and avoid spreading germs and exercising a bit of grace toward the thousands engaged at CDC HHS NIAIH.,Sun Mar 08 21:48:55 +0000 2020,0,0,0,53:08.8,comment
