Twitter ID,release date,comment,time,replies,retweets,likes,timestamp,stance
1838496903387306887,Tue Mar 24 2020,"Do we really think the first case in the USA was Jan 21 when this had been an incident since November 2019 (or earlier)? I know I got really bad pneumonia (1st time!), could not breath, and tested negetive for flu Dec 5 after a trip to #reinvent in Vegas.",Tue Mar 24 13:24:51 +0000 2020,0,5,5,44:19.3,comment
1838496903387306887,Tue Mar 24 2020,Killing innocent people due to incompetence.,Tue Mar 24 13:00:45 +0000 2020,0,1,1,44:19.3,comment
1838496903387306887,Tue Mar 24 2020,This is one of those incidents which one day in 2019 (november?!) it started as a SEV 4 ... but was not escalated /followed up on by appropriate global leaders until it was already a SEV 0 (major catastrophic incident). That is a hella long MTTD. https://t.co/xXPp6SfDyx,Tue Mar 24 12:59:21 +0000 2020,0,4,4,44:19.4,comment
1838496903387306887,Tue Mar 24 2020,"22nd Jan...me: ""what virus?"" https://t.co/K8OpVBuGZI",Tue Mar 24 13:06:30 +0000 2020,0,3,3,44:19.4,comment
1838496903387306887,Tue Mar 24 2020,The @WHO should have a tool for any doctor across the world to escalate a new threat to them which helps rate severity. Fast time to detection saves lives. @BillGates @melindagates @gatesfoundation,Tue Mar 24 13:39:20 +0000 2020,0,1,1,44:19.4,comment
1838496903387306887,Tue Mar 24 2020,Jan 21: https://t.co/9qps8JhvrY,Tue Mar 24 13:09:50 +0000 2020,0,1,1,44:19.4,comment
1838496903387306887,Tue Mar 24 2020,"The world is messed up and 17,226 innocent people have now died.",Tue Mar 24 13:21:05 +0000 2020,0,0,0,44:19.4,comment
1838496903387306887,Tue Mar 24 2020,"Latest on new coronavirus emerging from Wuhan, China: 6 now dead from the respiratory infection; stock prices of mask companies are rising; a case has been confirmed in Taiwan, which joins South Korea, Japan and Thailand as sites where virus reported. https://t.co/bctmgRrFE4",Tue Jan 21 12:17:39 +0000 2020,1466,2260,2260,44:19.4,comment
1838496903387306887,Tue Mar 24 2020,"RIP Dr Li Wenliang... the Dr who tried to escalate it but instead was silenced by the police and then died from coronavirus on Feb 7.....He had sent out a warning to fellow medics on 30 December but police told him to stop ""making false comments""....https://t.co/EQ6FcMk1kx",Tue Mar 24 13:15:23 +0000 2020,0,2,2,44:19.4,comment
