Twitter ID,release date,comment,time,replies,retweets,likes,timestamp,stance
7488256750616543958,Thu Apr 02 2020,MYTH: China's incompetence and lack of transparency caused the virus to spreadFACT: @WHO officials acknowledge that Chinas RAPID RESPONSE helped contain the spread and saved lives around the world https://t.co/vbHYvYKiZD,Thu Apr 02 17:04:25 +0000 2020,9,20,20,45:40.8,support
7488256750616543958,Thu Apr 02 2020,"MYTH: China threatens world suppliesFACT: China is supplying critical medical equipment, doctors, experties to countries AROUND THE WORLD https://t.co/RMd4YikKIY",Thu Apr 02 17:04:26 +0000 2020,7,29,29,45:40.8,support
7488256750616543958,Thu Apr 02 2020,MYTH: The virus is a Chinese bio-weaponFACT: The virus originated in nature https://t.co/MXrrfF8x2Z,Thu Apr 02 17:04:24 +0000 2020,5,21,21,45:40.8,support
7488256750616543958,Thu Apr 02 2020,The U.S. govt and media are waging a campaign of criticism against China and its response to the COVID-19 pandemic. Much of this diverts attention from the neglect of the U.S. govt in fighting the virus here.Here are 7 myths and facts about China. https://t.co/vOO9alc7uk,Thu Apr 02 17:04:24 +0000 2020,44,70,70,45:40.8,support
7488256750616543958,Thu Apr 02 2020,"MYTH: Covid-19 is ""Chinese virus"" and China is to blameFACT: That is a RACIST DIVERSION from fighting the virus https://t.co/cMAb4vF2zN",Thu Apr 02 17:04:24 +0000 2020,8,24,24,45:40.8,support
7488256750616543958,Thu Apr 02 2020,"MYTH: China's hospital, supply shortage endangered peopleFACTS:?All treatment is free?Multiple hospitals built in 1-2 weeks??Sports venues converted to hospitals?????????? 42k medics sent to Hubei? Thousands of factories refitted to produce masks, respirators, supplies https://t.co/BjwHAwx3Cy",Thu Apr 02 17:04:26 +0000 2020,11,29,29,45:40.8,support
7488256750616543958,Thu Apr 02 2020,MYTH: China prevented U.S. experts from helpingFACT: Trump REMOVED U.S. experts from China https://t.co/9OBfmaExQu,Thu Apr 02 17:04:25 +0000 2020,6,19,19,45:40.8,support
